{
  "schema_version": "1.0",
  "registry_id": "MELLYCORE_LOOP_REGISTRY_001",
  "task_id": "MELLYCORE-LOOP-OPERATIONS-FOUNDATION-001",
  "phase": 1,
  "phase_note": "Phase 1 is report-only. No loop may write to the repository, push, merge, deploy, comment, or call a provider. Enabling an action-capable loop requires a separate, explicitly approved task.",
  "global_kill_switch": {
    "file": "shared_context/loops/KILL_SWITCH",
    "semantics": "If this file exists, every loop must halt. Absence of the file is not permission to act; it only means the global halt is not engaged.",
    "present_by_default": false
  },
  "global_forbidden_paths": [
    ".env",
    ".env.*",
    "secrets/**",
    "credentials/**",
    "auth/**",
    "payments/**",
    "billing/**",
    "migrations/**",
    "infra/production/**",
    ".github/workflows/**",
    "shared_context/PROVIDER_SETUP.md",
    "**/provider_keys*",
    "**/MellyTrade/**",
    "**/mellytrade/**"
  ],
  "global_forbidden_paths_note": "Every loop entry must repeat this baseline in its own forbidden_paths list. The validator enforces the superset rule so that drift becomes a validation failure rather than a silent gap.",
  "lifecycle_states": [
    "DRAFT",
    "REPORT_ONLY",
    "ASSISTED",
    "WAITING_HUMAN",
    "PAUSED",
    "BLOCKED",
    "COMPLETED",
    "DISABLED"
  ],
  "levels": {
    "L0": "Manual. A human runs it; the loop definition only documents intent.",
    "L1": "Report-only. Reads state and emits findings. No repository mutation.",
    "L2": "Assisted. May propose a change behind a human gate. Not permitted in Phase 1.",
    "L3": "Unattended. Not designed, not configured, and not permitted in Phase 1."
  },
  "loops": [
    {
      "id": "project-health",
      "title": "Project Health Report",
      "purpose": "Report repository state, validator outcomes, active blockers, and the current task position so an operator can see project status without reading every shared_context file.",
      "owner": "operator",
      "level": "L1",
      "status": "REPORT_ONLY",
      "trigger_type": "manual",
      "suggested_cadence": "daily",
      "read_scope": [
        "shared_context/**",
        "docs/**",
        "scripts/**",
        "README.md"
      ],
      "allowed_write_scope": [],
      "forbidden_paths": [
        ".env",
        ".env.*",
        "secrets/**",
        "credentials/**",
        "auth/**",
        "payments/**",
        "billing/**",
        "migrations/**",
        "infra/production/**",
        ".github/workflows/**",
        "shared_context/PROVIDER_SETUP.md",
        "**/provider_keys*",
        "**/MellyTrade/**",
        "**/mellytrade/**"
      ],
      "state_file": "shared_context/loops/states/project-health.state.json",
      "state_file_is_template": true,
      "verifier_required": false,
      "max_attempts": 3,
      "stagnation_threshold": 2,
      "no_progress_threshold": 2,
      "per_run_token_budget": 60000,
      "daily_token_budget": 180000,
      "human_gates": [
        "report_reviewed_by_operator"
      ],
      "kill_switch": "shared_context/loops/KILL_SWITCH",
      "success_condition": "A health report is produced that names the current branch, the validator outcome, and any open blocker, with every claim traceable to a file that was actually read.",
      "escalation_condition": "The validator cannot be run, the repository state contradicts shared_context, or the loop cannot substantiate a claim it is about to make."
    },
    {
      "id": "context-drift",
      "title": "Shared Context Drift Report",
      "purpose": "Report contradictions between shared_context files, the roadmap, the run queue, the safety documents, and PROJECT_RULES.md, so that stale or conflicting claims are surfaced rather than inherited.",
      "owner": "operator",
      "level": "L1",
      "status": "REPORT_ONLY",
      "trigger_type": "manual",
      "suggested_cadence": "weekly",
      "read_scope": [
        "shared_context/**",
        "docs/**",
        "PROJECT_RULES.md",
        "AGENTS.md",
        "CLAUDE.md",
        "README.md"
      ],
      "allowed_write_scope": [],
      "forbidden_paths": [
        ".env",
        ".env.*",
        "secrets/**",
        "credentials/**",
        "auth/**",
        "payments/**",
        "billing/**",
        "migrations/**",
        "infra/production/**",
        ".github/workflows/**",
        "shared_context/PROVIDER_SETUP.md",
        "**/provider_keys*",
        "**/MellyTrade/**",
        "**/mellytrade/**"
      ],
      "state_file": "shared_context/loops/states/context-drift.state.json",
      "state_file_is_template": true,
      "verifier_required": true,
      "max_attempts": 3,
      "stagnation_threshold": 2,
      "no_progress_threshold": 2,
      "per_run_token_budget": 90000,
      "daily_token_budget": 180000,
      "human_gates": [
        "contradiction_confirmed_by_operator",
        "ledger_entry_approved_by_operator"
      ],
      "kill_switch": "shared_context/loops/KILL_SWITCH",
      "success_condition": "Each reported contradiction cites both sides with file path and quoted claim, and is proposed for CONTRADICTION_LEDGER.md rather than written to it.",
      "escalation_condition": "A contradiction touches a safety rule, or the loop cannot determine which side is authoritative."
    },
    {
      "id": "safety-posture",
      "title": "Safety Posture Report",
      "purpose": "Report on forbidden capabilities, secret-shaped strings, environment files, provider configuration, and the MellyCore/MellyTrade separation boundary.",
      "owner": "operator",
      "level": "L1",
      "status": "REPORT_ONLY",
      "trigger_type": "manual",
      "suggested_cadence": "weekly",
      "read_scope": [
        "shared_context/**",
        "docs/safety/**",
        "scripts/**",
        ".env.example",
        ".gitignore"
      ],
      "allowed_write_scope": [],
      "forbidden_paths": [
        ".env",
        ".env.*",
        "secrets/**",
        "credentials/**",
        "auth/**",
        "payments/**",
        "billing/**",
        "migrations/**",
        "infra/production/**",
        ".github/workflows/**",
        "shared_context/PROVIDER_SETUP.md",
        "**/provider_keys*",
        "**/MellyTrade/**",
        "**/mellytrade/**"
      ],
      "state_file": "shared_context/loops/states/safety-posture.state.json",
      "state_file_is_template": true,
      "verifier_required": true,
      "max_attempts": 2,
      "stagnation_threshold": 2,
      "no_progress_threshold": 2,
      "per_run_token_budget": 60000,
      "daily_token_budget": 120000,
      "human_gates": [
        "finding_reviewed_by_operator"
      ],
      "kill_switch": "shared_context/loops/KILL_SWITCH",
      "success_condition": "A posture report is produced that names category and location for every finding and never reproduces a candidate secret value.",
      "escalation_condition": "Any suspected real credential, any .env file in the working tree, or any MellyTrade execution surface appearing inside MellyCore."
    },
    {
      "id": "pr-review-monitor",
      "title": "PR And Review Readiness Report",
      "purpose": "Report the readiness of open work for review: what is committed, what is validated, and what is still missing. Reporting only.",
      "owner": "operator",
      "level": "L1",
      "status": "REPORT_ONLY",
      "trigger_type": "manual",
      "suggested_cadence": "on_demand",
      "read_scope": [
        "shared_context/**",
        "docs/tasks/**"
      ],
      "allowed_write_scope": [],
      "forbidden_paths": [
        ".env",
        ".env.*",
        "secrets/**",
        "credentials/**",
        "auth/**",
        "payments/**",
        "billing/**",
        "migrations/**",
        "infra/production/**",
        ".github/workflows/**",
        "shared_context/PROVIDER_SETUP.md",
        "**/provider_keys*",
        "**/MellyTrade/**",
        "**/mellytrade/**"
      ],
      "state_file": "shared_context/loops/states/pr-review-monitor.state.json",
      "state_file_is_template": true,
      "verifier_required": false,
      "max_attempts": 2,
      "stagnation_threshold": 2,
      "no_progress_threshold": 2,
      "per_run_token_budget": 40000,
      "daily_token_budget": 80000,
      "human_gates": [
        "report_reviewed_by_operator"
      ],
      "kill_switch": "shared_context/loops/KILL_SWITCH",
      "success_condition": "A readiness summary is produced locally. No comment is posted, no branch is pushed, no PR is opened, edited, approved, or merged.",
      "escalation_condition": "Any request or apparent need to comment, push, approve, or merge. This loop has no such capability and must escalate instead.",
      "explicit_prohibitions": [
        "no GitHub API calls",
        "no PR or issue comments",
        "no push",
        "no merge",
        "no approval"
      ]
    },
    {
      "id": "worktree-hygiene",
      "title": "Worktree Hygiene Report",
      "purpose": "Report linked worktrees, branch ownership, dirty worktrees, staleness, and collision risk between concurrent agent tasks.",
      "owner": "operator",
      "level": "L1",
      "status": "REPORT_ONLY",
      "trigger_type": "manual",
      "suggested_cadence": "weekly",
      "read_scope": [
        "shared_context/BRANCH_INVENTORY_001.md",
        "shared_context/loops/**"
      ],
      "allowed_write_scope": [],
      "forbidden_paths": [
        ".env",
        ".env.*",
        "secrets/**",
        "credentials/**",
        "auth/**",
        "payments/**",
        "billing/**",
        "migrations/**",
        "infra/production/**",
        ".github/workflows/**",
        "shared_context/PROVIDER_SETUP.md",
        "**/provider_keys*",
        "**/MellyTrade/**",
        "**/mellytrade/**"
      ],
      "state_file": "shared_context/loops/states/worktree-hygiene.state.json",
      "state_file_is_template": true,
      "verifier_required": false,